mysql> USE STUDENT1;
Database changed
mysql> SELECT*FROM STUDENT;
+-------------+---------+--------+-----------+------------+-----------+------------+
| REGISTER_NO | NAME    | GENDER | PHONE_NO  | CITY       | COURSE_NO | DOB        |
+-------------+---------+--------+-----------+------------+-----------+------------+
|   192121137 | SELMIYA | F      | 737358065 | CHENNAI    | c001      | 1998-01-22 |
|   192124189 | AARTHI  | F      | 737398065 | CHENNAI    | c002      | 2002-02-23 |
|   192011003 | REYAN   | M      | 737358065 | CHENNAI    | c003      | 2003-06-15 |
|   192011004 | HADDY   | M      |  73735465 | SELAIYUR   | c004      | 2002-08-23 |
|   192011008 | HADDIN  | M      | 737355545 | MEDAVAKKAM | c001      | 2002-08-23 |
|   192125421 | JATIN   | M      | 737354565 | CHROMPET   | c003      | 2000-01-23 |
+-------------+---------+--------+-----------+------------+-----------+------------+
6 rows in set (0.02 sec)

mysql> SELECT @@autocommit;
+--------------+
| @@autocommit |
+--------------+
|            1 |
+--------------+
1 row in set (0.01 sec)
mysql> INSERT INTO Student VALUES(1921110577,'SANJAY','M','77085505','VELLORE','c006','2002-03-13');
Query OK, 1 row affected (0.03 sec)
mysql> SELECT*FROM STUDENT;
+-------------+---------+--------+-----------+------------+-----------+------------+
| REGISTER_NO | NAME    | GENDER | PHONE_NO  | CITY       | COURSE_NO | DOB        |
+-------------+---------+--------+-----------+------------+-----------+------------+
|   192121137 | SELMIYA | F      | 737358065 | CHENNAI    | c001      | 1998-01-22 |
|   192124189 | AARTHI  | F      | 737398065 | CHENNAI    | c002      | 2002-02-23 |
|   192011003 | REYAN   | M      | 737358065 | CHENNAI    | c003      | 2003-06-15 |
|   192011004 | HADDY   | M      |  73735465 | SELAIYUR   | c004      | 2002-08-23 |
|   192011008 | HADDIN  | M      | 737355545 | MEDAVAKKAM | c001      | 2002-08-23 |
|   192125421 | JATIN   | M      | 737354565 | CHROMPET   | c003      | 2000-01-23 |
|  1921110577 | SANJAY  | M      |  77085505 | VELLORE    | c006      | 2002-03-13 |
+-------------+---------+--------+-----------+------------+-----------+------------+
7 rows in set (0.00 sec)

mysql> SET @@autocommit=0;
Query OK, 0 rows affected (0.01 sec)

mysql> select @@autocommit;
+--------------+
| @@autocommit |
+--------------+
|            0 |
+--------------+
1 row in set (0.00 sec)

mysql> delete from Student where CITY='VELLORE';
Query OK, 1 row affected (0.02 sec)

mysql> SELECT*FROM STUDENT;
+-------------+---------+--------+-----------+------------+-----------+------------+
| REGISTER_NO | NAME    | GENDER | PHONE_NO  | CITY       | COURSE_NO | DOB        |
+-------------+---------+--------+-----------+------------+-----------+------------+
|   192121137 | SELMIYA | F      | 737358065 | CHENNAI    | c001      | 1998-01-22 |
|   192124189 | AARTHI  | F      | 737398065 | CHENNAI    | c002      | 2002-02-23 |
|   192011003 | REYAN   | M      | 737358065 | CHENNAI    | c003      | 2003-06-15 |
|   192011004 | HADDY   | M      |  73735465 | SELAIYUR   | c004      | 2002-08-23 |
|   192011008 | HADDIN  | M      | 737355545 | MEDAVAKKAM | c001      | 2002-08-23 |
|   192125421 | JATIN   | M      | 737354565 | CHROMPET   | c003      | 2000-01-23 |
+-------------+---------+--------+-----------+------------+-----------+------------+
6 rows in set (0.00 sec)

mysql> ROLLBACK;
Query OK, 0 rows affected (0.01 sec)

mysql> SELECT*FROM STUDENT;
+-------------+---------+--------+-----------+------------+-----------+------------+
| REGISTER_NO | NAME    | GENDER | PHONE_NO  | CITY       | COURSE_NO | DOB        |
+-------------+---------+--------+-----------+------------+-----------+------------+
|   192121137 | SELMIYA | F      | 737358065 | CHENNAI    | c001      | 1998-01-22 |
|   192124189 | AARTHI  | F      | 737398065 | CHENNAI    | c002      | 2002-02-23 |
|   192011003 | REYAN   | M      | 737358065 | CHENNAI    | c003      | 2003-06-15 |
|   192011004 | HADDY   | M      |  73735465 | SELAIYUR   | c004      | 2002-08-23 |
|   192011008 | HADDIN  | M      | 737355545 | MEDAVAKKAM | c001      | 2002-08-23 |
|   192125421 | JATIN   | M      | 737354565 | CHROMPET   | c003      | 2000-01-23 |
|  1921110577 | SANJAY  | M      |  77085505 | VELLORE    | c006      | 2002-03-13 |
+-------------+---------+--------+-----------+------------+-----------+------------+
7 rows in set (0.00 sec)
